Ether / IP / TCP 35.186.227.140:https > 192.168.1.3:51013 PA / Raw
Ether / IP / TCP 35.186.227.140:https > 192.168.1.3:51013 PA / Raw
Ether / IP / TCP 35.186.227.140:https > 192.168.1.3:51013 PA / Raw
Ether / IP / TCP 192.168.1.3:51013 > 35.186.227.140:https A
Ether / IP / TCP 192.168.1.3:51013 > 35.186.227.140:https PA / Raw
Ether / IP / TCP 192.168.1.3:51013 > 35.186.227.140:https PA / Raw
Ether / IP / TCP 35.186.227.140:https > 192.168.1.3:51013 A
Ether / IP / TCP 35.186.227.140:https > 192.168.1.3:51013 A
Ether / IP / UDP 34.110.207.168:https > 192.168.1.3:62676 / Raw
Ether / IP / UDP 192.168.1.3:62676 > 34.110.207.168:https / Raw
Ether / IP / UDP 34.110.207.168:https > 192.168.1.3:62676 / Raw
Ether / IP / TCP 35.186.227.140:https > 192.168.1.3:51013 PA / Raw
Ether / IP / TCP 35.186.227.140:https > 192.168.1.3:51013 PA / Raw
Ether / IP / TCP 35.186.227.140:https > 192.168.1.3:51013 PA / Raw
Ether / IP / TCP 192.168.1.3:51013 > 35.186.227.140:https A
Ether / IP / TCP 192.168.1.3:51013 > 35.186.227.140:https PA / Raw
Ether / IP / TCP 192.168.1.3:51013 > 35.186.227.140:https PA / Raw
Ether / IP / TCP 35.186.227.140:https > 192.168.1.3:51013 A
Ether / IP / TCP 35.186.227.140:https > 192.168.1.3:51013 A
Ether / IP / TCP 35.186.227.140:https > 192.168.1.3:51013 PA / Raw
Ether / IP / TCP 35.186.227.140:https > 192.168.1.3:51013 PA / Raw
Ether / IP / TCP 35.186.227.140:https > 192.168.1.3:51013 PA / Raw
Ether / IP / TCP 35.186.227.140:https > 192.168.1.3:51013 PA / Raw
Ether / IP / TCP 192.168.1.3:51013 > 35.186.227.140:https A
Ether / IP / TCP 192.168.1.3:51013 > 35.186.227.140:https PA / Raw
Ether / IP / TCP 35.186.227.140:https > 192.168.1.3:51013 A
Ether / IP / TCP 192.168.1.3:51013 > 35.186.227.140:https PA / Raw
Ether / IP / TCP 192.168.1.3:51013 > 35.186.227.140:https PA / Raw
Ether / IP / TCP 192.168.1.3:51013 > 35.186.227.140:https A / Raw
Ether / IP / TCP 192.168.1.3:51013 > 35.186.227.140:https A / Raw
Ether / IP / TCP 192.168.1.3:51013 > 35.186.227.140:https A / Raw
Ether / IP / TCP 192.168.1.3:51013 > 35.186.227.140:https PA / Raw
Ether / IP / TCP 35.186.227.140:https > 192.168.1.3:51013 A
Ether / IP / TCP 35.186.227.140:https > 192.168.1.3:51013 A
Ether / IP / TCP 35.186.227.140:https > 192.168.1.3:51013 A
Ether / IP / TCP 35.186.227.140:https > 192.168.1.3:51013 A
Ether / IP / TCP 35.186.227.140:https > 192.168.1.3:51013 A
Ether / IP / TCP 35.186.227.140:https > 192.168.1.3:51013 A
Ether / IP / TCP 35.186.227.140:https > 192.168.1.3:51013 PA / Raw
Ether / IP / TCP 35.186.227.140:https > 192.168.1.3:51013 PA / Raw
Ether / IP / TCP 35.186.227.140:https > 192.168.1.3:51013 PA / Raw
Ether / IP / TCP 192.168.1.3:51013 > 35.186.227.140:https A
Ether / IP / TCP 192.168.1.3:51013 > 35.186.227.140:https PA / Raw
Ether / IP / TCP 192.168.1.3:51013 > 35.186.227.140:https PA / Raw
Ether / IP / TCP 192.168.1.3:51013 > 35.186.227.140:https PA / Raw
Ether / IP / TCP 192.168.1.3:51013 > 35.186.227.140:https A / Raw
Ether / IP / TCP 192.168.1.3:51013 > 35.186.227.140:https PA / Raw
Ether / IP / TCP 35.186.227.140:https > 192.168.1.3:51013 A
Ether / IP / TCP 35.186.227.140:https > 192.168.1.3:51013 A
Ether / IP / TCP 35.186.227.140:https > 192.168.1.3:51013 A
Ether / IP / TCP 35.186.227.140:https > 192.168.1.3:51013 A
Ether / IP / TCP 35.186.227.140:https > 192.168.1.3:51013 A
Ether / IP / TCP 35.186.227.140:https > 192.168.1.3:51013 PA / Raw
Ether / IP / TCP 35.186.227.140:https > 192.168.1.3:51013 PA / Raw
Ether / IP / TCP 35.186.227.140:https > 192.168.1.3:51013 PA / Raw
Ether / IP / TCP 192.168.1.3:51013 > 35.186.227.140:https A
Ether / IP / TCP 192.168.1.3:51013 > 35.186.227.140:https PA / Raw
Ether / IP / TCP 35.186.227.140:https > 192.168.1.3:51013 A
10:a3:b8:3b:9d:30 > ff:ff:ff:ff:ff:ff (0x88e1) / Raw
Ether / IP / TCP 155.133.252.68:27022 > 192.168.1.3:50476 PA / Raw
Ether / IP / TCP 192.168.1.3:50476 > 155.133.252.68:27022 A
10:a3:b8:3b:9d:30 > ff:ff:ff:ff:ff:ff (0x88e1) / Raw
Ether / IP / TCP 149.154.167.50:https > 192.168.1.3:50440 PA / Raw
Ether / IP / TCP 149.154.167.50:https > 192.168.1.3:50440 PA / Raw
Ether / IP / TCP 192.168.1.3:50440 > 149.154.167.50:https A
Ether / IP / TCP 192.168.1.3:50440 > 149.154.167.50:https PA / Raw
Ether / IP / TCP 149.154.167.50:https > 192.168.1.3:50440 A
Ether / IP / TCP 149.154.167.50:https > 192.168.1.3:50440 PA / Raw
Ether / IP / TCP 192.168.1.3:50440 > 149.154.167.50:https A
Ether / IP / TCP 149.154.167.50:https > 192.168.1.3:50440 PA / Raw
Ether / IP / TCP 192.168.1.3:50440 > 149.154.167.50:https A
Ether / IP / TCP 192.168.1.3:50440 > 149.154.167.50:https PA / Raw
Ether / IP / TCP 149.154.167.50:https > 192.168.1.3:50440 A
Ether / IP / TCP 149.154.167.50:https > 192.168.1.3:50440 PA / Raw
Ether / IP / TCP 192.168.1.3:50440 > 149.154.167.50:https A
10:a3:b8:3b:9d:30 > ff:ff:ff:ff:ff:ff (0x88e1) / Raw
Ether / IP / TCP 149.154.167.50:https > 192.168.1.3:50440 PA / Raw
Ether / IP / TCP 192.168.1.3:50440 > 149.154.167.50:https A
Ether / IP / TCP 149.154.167.50:https > 192.168.1.3:50440 PA / Raw
Ether / IP / TCP 192.168.1.3:50440 > 149.154.167.50:https A
Ether / IP / TCP 149.154.167.50:https > 192.168.1.3:50440 PA / Raw
Ether / IP / TCP 192.168.1.3:50440 > 149.154.167.50:https A
Ether / IP / TCP 162.159.135.234:https > 192.168.1.3:51019 PA / Raw
Ether / IP / TCP 192.168.1.3:51019 > 162.159.135.234:https A
Ether / IP / UDP / DNS Qry b'api.msn.com.'
Ether / IP / UDP / DNS Qry b'api.msn.com.'
Ether / IP / UDP / DNS Ans b'api-msn-com-oneservice-world-default.trafficmanager.net.'
Ether / IP / UDP / DNS Ans b'api-msn-com-oneservice-world-default.trafficmanager.net.'
Ether / IP / TCP 192.168.1.3:51027 > 204.79.197.203:https S
Ether / IP / TCP 204.79.197.203:https > 192.168.1.3:51027 SA
Ether / IP / TCP 192.168.1.3:51027 > 204.79.197.203:https A
Ether / IP / TCP 192.168.1.3:51027 > 204.79.197.203:https A / Raw
Ether / IP / TCP 192.168.1.3:51027 > 204.79.197.203:https PA / Raw
Ether / IP / TCP 204.79.197.203:https > 192.168.1.3:51027 A
Ether / IP / TCP 204.79.197.203:https > 192.168.1.3:51027 A
Ether / IP / TCP 204.79.197.203:https > 192.168.1.3:51027 PA / Raw
Ether / IP / TCP 192.168.1.3:51027 > 204.79.197.203:https PA / Raw
Ether / IP / TCP 204.79.197.203:https > 192.168.1.3:51027 A
Ether / IP / TCP 204.79.197.203:https > 192.168.1.3:51027 A / Raw
Ether / IP / TCP 204.79.197.203:https > 192.168.1.3:51027 A / Raw
Ether / IP / TCP 204.79.197.203:https > 192.168.1.3:51027 A / Raw
Ether / IP / TCP 204.79.197.203:https > 192.168.1.3:51027 A / Raw
Ether / IP / TCP 204.79.197.203:https > 192.168.1.3:51027 PA / Raw
Ether / IP / TCP 192.168.1.3:51027 > 204.79.197.203:https A
Ether / IP / TCP 192.168.1.3:51027 > 204.79.197.203:https PA / Raw
Ether / IP / TCP 192.168.1.3:51027 > 204.79.197.203:https PA / Raw
Ether / IP / TCP 192.168.1.3:51027 > 204.79.197.203:https PA / Raw
Ether / IP / TCP 192.168.1.3:51027 > 204.79.197.203:https PA / Raw
Ether / IP / TCP 204.79.197.203:https > 192.168.1.3:51027 A
Ether / IP / TCP 204.79.197.203:https > 192.168.1.3:51027 PA / Raw
Ether / IP / TCP 204.79.197.203:https > 192.168.1.3:51027 PA / Raw
Ether / IP / TCP 204.79.197.203:https > 192.168.1.3:51027 A
Ether / IP / TCP 204.79.197.203:https > 192.168.1.3:51027 PA / Raw
Ether / IP / TCP 204.79.197.203:https > 192.168.1.3:51027 A
Ether / IP / TCP 192.168.1.3:51027 > 204.79.197.203:https A
Ether / IP / TCP 192.168.1.3:51027 > 204.79.197.203:https PA / Raw
Ether / IP / TCP 204.79.197.203:https > 192.168.1.3:51027 A
Ether / IP / UDP / DNS Qry b'assets.msn.com.'
Ether / IP / UDP / DNS Ans b'assets.msn.com.edgesuite.net.'
Ether / IP / TCP 192.168.1.3:51028 > 92.123.102.65:https S
Ether / IP / TCP 204.79.197.203:https > 192.168.1.3:51027 A / Raw
Ether / IP / TCP 204.79.197.203:https > 192.168.1.3:51027 PA / Raw
Ether / IP / TCP 204.79.197.203:https > 192.168.1.3:51027 PA / Raw
Ether / IP / TCP 204.79.197.203:https > 192.168.1.3:51027 PA / Raw
Ether / IP / TCP 204.79.197.203:https > 192.168.1.3:51027 PA / Raw
Ether / IP / TCP 192.168.1.3:51027 > 204.79.197.203:https A
Ether / IP / TCP 192.168.1.3:51029 > 204.79.197.203:https S
Ether / IP / TCP 92.123.102.65:https > 192.168.1.3:51028 SA
Ether / IP / TCP 192.168.1.3:51028 > 92.123.102.65:https A
Ether / IP / TCP 192.168.1.3:51028 > 92.123.102.65:https PA / Raw
Ether / IP / TCP 204.79.197.203:https > 192.168.1.3:51029 SA
Ether / IP / TCP 192.168.1.3:51029 > 204.79.197.203:https A
Ether / IP / TCP 192.168.1.3:51029 > 204.79.197.203:https A / Raw
Ether / IP / TCP 192.168.1.3:51029 > 204.79.197.203:https PA / Raw
Ether / IP / TCP 92.123.102.65:https > 192.168.1.3:51028 PA / Raw
Ether / IP / TCP 192.168.1.3:51028 > 92.123.102.65:https A
Ether / IP / TCP 204.79.197.203:https > 192.168.1.3:51029 A
Ether / IP / TCP 204.79.197.203:https > 192.168.1.3:51029 A
Ether / IP / TCP 204.79.197.203:https > 192.168.1.3:51029 PA / Raw
Ether / IP / TCP 192.168.1.3:51029 > 204.79.197.203:https PA / Raw
Ether / IP / TCP 192.168.1.3:51028 > 92.123.102.65:https PA / Raw
Ether / IP / TCP 192.168.1.3:51028 > 92.123.102.65:https PA / Raw
Ether / IP / TCP 192.168.1.3:51028 > 92.123.102.65:https PA / Raw
Ether / IP / TCP 204.79.197.203:https > 192.168.1.3:51029 A
Ether / IP / TCP 92.123.102.65:https > 192.168.1.3:51028 A
Ether / IP / TCP 92.123.102.65:https > 192.168.1.3:51028 A
Ether / IP / TCP 204.79.197.203:https > 192.168.1.3:51029 A / Raw
Ether / IP / TCP 204.79.197.203:https > 192.168.1.3:51029 A / Raw
Ether / IP / TCP 204.79.197.203:https > 192.168.1.3:51029 A / Raw
Ether / IP / TCP 204.79.197.203:https > 192.168.1.3:51029 A / Raw
Ether / IP / TCP 204.79.197.203:https > 192.168.1.3:51029 PA / Raw
Ether / IP / TCP 92.123.102.65:https > 192.168.1.3:51028 A
Ether / IP / TCP 92.123.102.65:https > 192.168.1.3:51028 PA / Raw
Ether / IP / TCP 192.168.1.3:51029 > 204.79.197.203:https A
Ether / IP / TCP 192.168.1.3:51028 > 92.123.102.65:https A
Ether / IP / TCP 192.168.1.3:51029 > 204.79.197.203:https PA / Raw
Ether / IP / TCP 192.168.1.3:51029 > 204.79.197.203:https PA / Raw
Ether / IP / TCP 192.168.1.3:51029 > 204.79.197.203:https PA / Raw
Ether / IP / TCP 192.168.1.3:51029 > 204.79.197.203:https PA / Raw
Ether / IP / TCP 204.79.197.203:https > 192.168.1.3:51029 A
Ether / IP / TCP 204.79.197.203:https > 192.168.1.3:51029 PA / Raw
Ether / IP / TCP 204.79.197.203:https > 192.168.1.3:51029 A
Ether / IP / TCP 92.123.102.65:https > 192.168.1.3:51028 PA / Raw
Ether / IP / TCP 92.123.102.65:https > 192.168.1.3:51028 PA / Raw
Ether / IP / TCP 204.79.197.203:https > 192.168.1.3:51029 PA / Raw
Ether / IP / TCP 204.79.197.203:https > 192.168.1.3:51029 PA / Raw
Ether / IP / TCP 204.79.197.203:https > 192.168.1.3:51029 A
Ether / IP / TCP 192.168.1.3:51029 > 204.79.197.203:https A
Ether / IP / TCP 192.168.1.3:51028 > 92.123.102.65:https A
Ether / IP / TCP 192.168.1.3:51028 > 92.123.102.65:https PA / Raw
Ether / IP / TCP 192.168.1.3:51029 > 204.79.197.203:https PA / Raw
Ether / IP / TCP 204.79.197.203:https > 192.168.1.3:51029 A
Ether / IP / TCP 92.123.102.65:https > 192.168.1.3:51028 A
Ether / IP / TCP 204.79.197.203:https > 192.168.1.3:51029 A / Raw
Ether / IP / TCP 204.79.197.203:https > 192.168.1.3:51029 PA / Raw
Ether / IP / TCP 204.79.197.203:https > 192.168.1.3:51029 PA / Raw
Ether / IP / TCP 204.79.197.203:https > 192.168.1.3:51029 PA / Raw
Ether / IP / TCP 204.79.197.203:https > 192.168.1.3:51029 PA / Raw
Ether / IP / TCP 192.168.1.3:51029 > 204.79.197.203:https A
Ether / IP / TCP 92.123.102.65:https > 192.168.1.3:51028 A / Raw
Ether / IP / TCP 92.123.102.65:https > 192.168.1.3:51028 A / Raw
Ether / IP / TCP 92.123.102.65:https > 192.168.1.3:51028 PA / Raw
Ether / IP / TCP 92.123.102.65:https > 192.168.1.3:51028 A / Raw
Ether / IP / TCP 92.123.102.65:https > 192.168.1.3:51028 A / Raw
Ether / IP / TCP 92.123.102.65:https > 192.168.1.3:51028 A / Raw
Ether / IP / TCP 92.123.102.65:https > 192.168.1.3:51028 A / Raw
Ether / IP / TCP 92.123.102.65:https > 192.168.1.3:51028 A / Raw
Ether / IP / TCP 92.123.102.65:https > 192.168.1.3:51028 A / Raw
Ether / IP / TCP 92.123.102.65:https > 192.168.1.3:51028 A / Raw
Ether / IP / TCP 92.123.102.65:https > 192.168.1.3:51028 A / Raw
Ether / IP / TCP 92.123.102.65:https > 192.168.1.3:51028 A / Raw
Ether / IP / TCP 92.123.102.65:https > 192.168.1.3:51028 PA / Raw
Ether / IP / TCP 92.123.102.65:https > 192.168.1.3:51028 A / Raw
Ether / IP / TCP 92.123.102.65:https > 192.168.1.3:51028 A / Raw
Ether / IP / TCP 92.123.102.65:https > 192.168.1.3:51028 A / Raw
Ether / IP / TCP 92.123.102.65:https > 192.168.1.3:51028 A / Raw
Ether / IP / TCP 92.123.102.65:https > 192.168.1.3:51028 A / Raw
Ether / IP / TCP 92.123.102.65:https > 192.168.1.3:51028 A / Raw
Ether / IP / TCP 92.123.102.65:https > 192.168.1.3:51028 A / Raw
Ether / IP / TCP 92.123.102.65:https > 192.168.1.3:51028 A / Raw
Ether / IP / TCP 92.123.102.65:https > 192.168.1.3:51028 A / Raw
Ether / IP / TCP 92.123.102.65:https > 192.168.1.3:51028 PA / Raw
Ether / IP / TCP 92.123.102.65:https > 192.168.1.3:51028 A / Raw
Ether / IP / TCP 92.123.102.65:https > 192.168.1.3:51028 A / Raw
Ether / IP / TCP 92.123.102.65:https > 192.168.1.3:51028 PA / Raw
Ether / IP / TCP 92.123.102.65:https > 192.168.1.3:51028 A / Raw
Ether / IP / TCP 92.123.102.65:https > 192.168.1.3:51028 A / Raw
Ether / IP / TCP 92.123.102.65:https > 192.168.1.3:51028 A / Raw
Ether / IP / TCP 92.123.102.65:https > 192.168.1.3:51028 A / Raw
Ether / IP / TCP 92.123.102.65:https > 192.168.1.3:51028 A / Raw
Ether / IP / TCP 92.123.102.65:https > 192.168.1.3:51028 A / Raw
Ether / IP / TCP 92.123.102.65:https > 192.168.1.3:51028 A / Raw
Ether / IP / TCP 92.123.102.65:https > 192.168.1.3:51028 A / Raw
Ether / IP / TCP 92.123.102.65:https > 192.168.1.3:51028 A / Raw
Ether / IP / TCP 92.123.102.65:https > 192.168.1.3:51028 PA / Raw
Ether / IP / TCP 92.123.102.65:https > 192.168.1.3:51028 A / Raw
Ether / IP / TCP 92.123.102.65:https > 192.168.1.3:51028 PA / Raw
Ether / IP / TCP 92.123.102.65:https > 192.168.1.3:51028 A / Raw
Ether / IP / TCP 92.123.102.65:https > 192.168.1.3:51028 A / Raw
Ether / IP / TCP 92.123.102.65:https > 192.168.1.3:51028 A / Raw
Ether / IP / TCP 92.123.102.65:https > 192.168.1.3:51028 A / Raw
Ether / IP / TCP 92.123.102.65:https > 192.168.1.3:51028 A / Raw
Ether / IP / TCP 92.123.102.65:https > 192.168.1.3:51028 A / Raw
Ether / IP / TCP 92.123.102.65:https > 192.168.1.3:51028 A / Raw
Ether / IP / TCP 92.123.102.65:https > 192.168.1.3:51028 A / Raw
Ether / IP / TCP 92.123.102.65:https > 192.168.1.3:51028 A / Raw
Ether / IP / TCP 92.123.102.65:https > 192.168.1.3:51028 PA / Raw
Ether / IP / TCP 92.123.102.65:https > 192.168.1.3:51028 A / Raw
Ether / IP / TCP 192.168.1.3:51028 > 92.123.102.65:https A
Ether / IP / TCP 92.123.102.65:https > 192.168.1.3:51028 A / Raw
Ether / IP / TCP 92.123.102.65:https > 192.168.1.3:51028 A / Raw
Ether / IP / TCP 92.123.102.65:https > 192.168.1.3:51028 A / Raw
Ether / IP / TCP 92.123.102.65:https > 192.168.1.3:51028 A / Raw
Ether / IP / TCP 92.123.102.65:https > 192.168.1.3:51028 A / Raw
Ether / IP / TCP 92.123.102.65:https > 192.168.1.3:51028 A / Raw
Ether / IP / TCP 92.123.102.65:https > 192.168.1.3:51028 PA / Raw
Ether / IP / TCP 192.168.1.3:51028 > 92.123.102.65:https A
Ether / IP / UDP / DNS Qry b'assets.msn.com.'
Ether / IP / UDP / DNS Qry b'assets.msn.com.'
Ether / IP / UDP / DNS Ans b'assets.msn.com.edgesuite.net.'
Ether / IP / UDP / DNS Ans b'assets.msn.com.edgesuite.net.'
Ether / IP / UDP 192.168.1.3:65224 > 92.123.102.209:https / Raw
Ether / IP / UDP 192.168.1.3:65224 > 92.123.102.209:https / Raw
Ether / IP / UDP 92.123.102.209:https > 192.168.1.3:65224 / Raw
Ether / IP / UDP 92.123.102.209:https > 192.168.1.3:65224 / Raw
Ether / IP / UDP 92.123.102.209:https > 192.168.1.3:65224 / Raw
Ether / IP / UDP 192.168.1.3:65224 > 92.123.102.209:https / Raw
Ether / IP / UDP 192.168.1.3:65224 > 92.123.102.209:https / Raw
Ether / IP / UDP 192.168.1.3:65224 > 92.123.102.209:https / Raw
Ether / IP / UDP 92.123.102.209:https > 192.168.1.3:65224 / Raw
Ether / IP / UDP 92.123.102.209:https > 192.168.1.3:65224 / Raw
Ether / IP / UDP 92.123.102.209:https > 192.168.1.3:65224 / Raw
Ether / IP / UDP 92.123.102.209:https > 192.168.1.3:65224 / Raw
Ether / IP / UDP 92.123.102.209:https > 192.168.1.3:65224 / Raw
Ether / IP / UDP 192.168.1.3:65224 > 92.123.102.209:https / Raw
Ether / IP / UDP 192.168.1.3:65224 > 92.123.102.209:https / Raw
Ether / IP / UDP 92.123.102.209:https > 192.168.1.3:65224 / Raw
Ether / IP / UDP 92.123.102.209:https > 192.168.1.3:65224 / Raw
Ether / IP / UDP 192.168.1.3:65224 > 92.123.102.209:https / Raw
Ether / IP / UDP 92.123.102.209:https > 192.168.1.3:65224 / Raw
10:a3:b8:3b:9d:30 > ff:ff:ff:ff:ff:ff (0x88e1) / Raw
Ether / IP / TCP 192.168.1.3:51017 > 104.21.47.95:https PA / Raw
Ether / IP / TCP 104.21.47.95:https > 192.168.1.3:51017 PA / Raw
Ether / IP / TCP 192.168.1.3:51017 > 104.21.47.95:https A
Ether / IP / UDP / DNS Qry b'th.bing.com.'
Ether / IP / UDP / DNS Qry b'th.bing.com.'
Ether / IP / UDP / DNS Ans b'p-th.bing.com.trafficmanager.net.'
Ether / IP / UDP / DNS Ans b'p-th.bing.com.trafficmanager.net.'
Ether / IP / UDP 192.168.1.3:65534 > 92.123.103.96:https / Raw
Ether / IP / UDP 192.168.1.3:65534 > 92.123.103.96:https / Raw
Ether / IP / UDP 92.123.103.96:https > 192.168.1.3:65534 / Raw
Ether / IP / UDP 92.123.103.96:https > 192.168.1.3:65534 / Raw
Ether / IP / UDP 92.123.103.96:https > 192.168.1.3:65534 / Raw
Ether / IP / UDP 192.168.1.3:65534 > 92.123.103.96:https / Raw
Ether / IP / UDP 192.168.1.3:65534 > 92.123.103.96:https / Raw
Ether / IP / UDP 192.168.1.3:65534 > 92.123.103.96:https / Raw
Ether / IP / UDP 192.168.1.3:65534 > 92.123.103.96:https / Raw
Ether / IP / UDP 192.168.1.3:65534 > 92.123.103.96:https / Raw
Ether / IP / UDP 92.123.103.96:https > 192.168.1.3:65534 / Raw
Ether / IP / UDP 92.123.103.96:https > 192.168.1.3:65534 / Raw
Ether / IP / UDP 92.123.103.96:https > 192.168.1.3:65534 / Raw
Ether / IP / UDP 92.123.103.96:https > 192.168.1.3:65534 / Raw
Ether / IP / UDP 92.123.103.96:https > 192.168.1.3:65534 / Raw
Ether / IP / UDP 192.168.1.3:65534 > 92.123.103.96:https / Raw
Ether / IP / UDP 192.168.1.3:65534 > 92.123.103.96:https / Raw
Ether / IP / UDP 92.123.103.96:https > 192.168.1.3:65534 / Raw
Ether / IP / UDP 92.123.103.96:https > 192.168.1.3:65534 / Raw
Ether / IP / UDP 92.123.103.96:https > 192.168.1.3:65534 / Raw
Ether / IP / UDP 92.123.103.96:https > 192.168.1.3:65534 / Raw
Ether / IP / UDP 92.123.103.96:https > 192.168.1.3:65534 / Raw
Ether / IP / UDP 92.123.103.96:https > 192.168.1.3:65534 / Raw
Ether / IP / UDP 92.123.103.96:https > 192.168.1.3:65534 / Raw
Ether / IP / UDP 92.123.103.96:https > 192.168.1.3:65534 / Raw
Ether / IP / UDP 92.123.103.96:https > 192.168.1.3:65534 / Raw
Ether / IP / UDP 92.123.103.96:https > 192.168.1.3:65534 / Raw
Ether / IP / UDP 92.123.103.96:https > 192.168.1.3:65534 / Raw
Ether / IP / UDP 192.168.1.3:65534 > 92.123.103.96:https / Raw
Ether / IP / UDP 192.168.1.3:65534 > 92.123.103.96:https / Raw
Ether / IP / UDP 192.168.1.3:65534 > 92.123.103.96:https / Raw
Ether / IP / UDP 192.168.1.3:65534 > 92.123.103.96:https / Raw
Ether / IP / UDP 192.168.1.3:65534 > 92.123.103.96:https / Raw
Ether / IP / UDP 192.168.1.3:65224 > 92.123.102.209:https / Raw
Ether / IP / UDP 92.123.103.96:https > 192.168.1.3:65534 / Raw
Ether / IP / UDP 92.123.103.96:https > 192.168.1.3:65534 / Raw
Ether / IP / UDP 92.123.103.96:https > 192.168.1.3:65534 / Raw
Ether / IP / UDP 92.123.103.96:https > 192.168.1.3:65534 / Raw
Ether / IP / UDP 92.123.103.96:https > 192.168.1.3:65534 / Raw
Ether / IP / UDP 92.123.103.96:https > 192.168.1.3:65534 / Raw
Ether / IP / UDP 92.123.103.96:https > 192.168.1.3:65534 / Raw
Ether / IP / UDP 92.123.103.96:https > 192.168.1.3:65534 / Raw
Ether / IP / UDP 92.123.103.96:https > 192.168.1.3:65534 / Raw
Ether / IP / UDP 92.123.103.96:https > 192.168.1.3:65534 / Raw
Ether / IP / UDP 92.123.103.96:https > 192.168.1.3:65534 / Raw
Ether / IP / UDP 92.123.103.96:https > 192.168.1.3:65534 / Raw
Ether / IP / UDP 92.123.103.96:https > 192.168.1.3:65534 / Raw
Ether / IP / UDP 192.168.1.3:65534 > 92.123.103.96:https / Raw
Ether / IP / UDP 192.168.1.3:65534 > 92.123.103.96:https / Raw
Ether / IP / UDP 192.168.1.3:65534 > 92.123.103.96:https / Raw
Ether / IP / UDP 192.168.1.3:65534 > 92.123.103.96:https / Raw
Ether / IP / UDP 192.168.1.3:65534 > 92.123.103.96:https / Raw
Ether / IP / UDP 192.168.1.3:65534 > 92.123.103.96:https / Raw
Ether / IP / UDP 92.123.103.96:https > 192.168.1.3:65534 / Raw
Ether / IP / UDP 92.123.103.96:https > 192.168.1.3:65534 / Raw
Ether / IP / UDP 92.123.103.96:https > 192.168.1.3:65534 / Raw
Ether / IP / UDP 192.168.1.3:65534 > 92.123.103.96:https / Raw
Ether / IP / UDP 192.168.1.3:65534 > 92.123.103.96:https / Raw
Ether / IP / UDP 92.123.103.96:https > 192.168.1.3:65534 / Raw
Ether / IP / UDP 92.123.103.96:https > 192.168.1.3:65534 / Raw
Ether / IP / UDP 92.123.103.96:https > 192.168.1.3:65534 / Raw
Ether / IP / UDP 92.123.103.96:https > 192.168.1.3:65534 / Raw
Ether / IP / UDP 92.123.103.96:https > 192.168.1.3:65534 / Raw
Ether / IP / UDP 92.123.103.96:https > 192.168.1.3:65534 / Raw
Ether / IP / UDP 92.123.103.96:https > 192.168.1.3:65534 / Raw
Ether / IP / UDP 92.123.103.96:https > 192.168.1.3:65534 / Raw
Ether / IP / UDP 192.168.1.3:65534 > 92.123.103.96:https / Raw
Ether / IP / UDP 192.168.1.3:65534 > 92.123.103.96:https / Raw
Ether / IP / UDP 192.168.1.3:65534 > 92.123.103.96:https / Raw
Ether / IP / UDP 192.168.1.3:65534 > 92.123.103.96:https / Raw
Ether / IP / UDP 92.123.103.96:https > 192.168.1.3:65534 / Raw
Ether / IP / UDP 92.123.103.96:https > 192.168.1.3:65534 / Raw
Ether / IP / UDP 92.123.103.96:https > 192.168.1.3:65534 / Raw
Ether / IP / UDP 92.123.103.96:https > 192.168.1.3:65534 / Raw
Ether / IP / UDP 92.123.103.96:https > 192.168.1.3:65534 / Raw
Ether / IP / UDP 92.123.103.96:https > 192.168.1.3:65534 / Raw
Ether / IP / UDP 92.123.103.96:https > 192.168.1.3:65534 / Raw
Ether / IP / UDP 92.123.103.96:https > 192.168.1.3:65534 / Raw
Ether / IP / UDP 92.123.103.96:https > 192.168.1.3:65534 / Raw
Ether / IP / UDP 92.123.103.96:https > 192.168.1.3:65534 / Raw
Ether / IP / UDP 92.123.103.96:https > 192.168.1.3:65534 / Raw
Ether / IP / UDP 92.123.103.96:https > 192.168.1.3:65534 / Raw
Ether / IP / UDP 192.168.1.3:65534 > 92.123.103.96:https / Raw
Ether / IP / UDP 192.168.1.3:65534 > 92.123.103.96:https / Raw
Ether / IP / UDP 192.168.1.3:65534 > 92.123.103.96:https / Raw
Ether / IP / UDP 192.168.1.3:65534 > 92.123.103.96:https / Raw
Ether / IP / UDP 192.168.1.3:65534 > 92.123.103.96:https / Raw
Ether / IP / UDP 192.168.1.3:65534 > 92.123.103.96:https / Raw
Ether / IP / UDP 92.123.103.96:https > 192.168.1.3:65534 / Raw
Ether / IP / UDP 92.123.103.96:https > 192.168.1.3:65534 / Raw
Ether / IP / UDP 92.123.103.96:https > 192.168.1.3:65534 / Raw
Ether / IP / UDP 92.123.103.96:https > 192.168.1.3:65534 / Raw
Ether / IP / UDP 92.123.103.96:https > 192.168.1.3:65534 / Raw
Ether / IP / UDP 92.123.103.96:https > 192.168.1.3:65534 / Raw
Ether / IP / UDP 92.123.103.96:https > 192.168.1.3:65534 / Raw
Ether / IP / UDP 92.123.103.96:https > 192.168.1.3:65534 / Raw
Ether / IP / UDP 92.123.103.96:https > 192.168.1.3:65534 / Raw
Ether / IP / UDP 92.123.103.96:https > 192.168.1.3:65534 / Raw
Ether / IP / UDP 92.123.103.96:https > 192.168.1.3:65534 / Raw
Ether / IP / UDP 92.123.103.96:https > 192.168.1.3:65534 / Raw
Ether / IP / UDP 92.123.103.96:https > 192.168.1.3:65534 / Raw
Ether / IP / UDP 92.123.102.209:https > 192.168.1.3:65224 / Raw
Ether / IP / UDP 192.168.1.3:65534 > 92.123.103.96:https / Raw
Ether / IP / UDP 192.168.1.3:65534 > 92.123.103.96:https / Raw
Ether / IP / UDP 192.168.1.3:65534 > 92.123.103.96:https / Raw
Ether / IP / UDP 192.168.1.3:65534 > 92.123.103.96:https / Raw
Ether / IP / UDP 192.168.1.3:65534 > 92.123.103.96:https / Raw
Ether / IP / UDP 192.168.1.3:65534 > 92.123.103.96:https / Raw
Ether / IP / UDP 92.123.103.96:https > 192.168.1.3:65534 / Raw
Ether / IP / UDP 92.123.103.96:https > 192.168.1.3:65534 / Raw
Ether / IP / UDP 92.123.103.96:https > 192.168.1.3:65534 / Raw
Ether / IP / UDP 92.123.103.96:https > 192.168.1.3:65534 / Raw
Ether / IP / UDP 92.123.103.96:https > 192.168.1.3:65534 / Raw
Ether / IP / UDP 92.123.103.96:https > 192.168.1.3:65534 / Raw
Ether / IP / UDP 92.123.103.96:https > 192.168.1.3:65534 / Raw
Ether / IP / UDP 92.123.103.96:https > 192.168.1.3:65534 / Raw
Ether / IP / UDP 92.123.103.96:https > 192.168.1.3:65534 / Raw
Ether / IP / UDP 92.123.103.96:https > 192.168.1.3:65534 / Raw
Ether / IP / UDP 92.123.103.96:https > 192.168.1.3:65534 / Raw
Ether / IP / UDP 92.123.103.96:https > 192.168.1.3:65534 / Raw
Ether / IP / UDP 92.123.103.96:https > 192.168.1.3:65534 / Raw
Ether / IP / UDP 92.123.103.96:https > 192.168.1.3:65534 / Raw
Ether / IP / UDP 92.123.103.96:https > 192.168.1.3:65534 / Raw
Ether / IP / UDP 92.123.103.96:https > 192.168.1.3:65534 / Raw
Ether / IP / UDP 92.123.103.96:https > 192.168.1.3:65534 / Raw
Ether / IP / UDP 92.123.103.96:https > 192.168.1.3:65534 / Raw
Ether / IP / UDP 92.123.103.96:https > 192.168.1.3:65534 / Raw
Ether / IP / UDP 92.123.103.96:https > 192.168.1.3:65534 / Raw
Ether / IP / UDP 92.123.103.96:https > 192.168.1.3:65534 / Raw
Ether / IP / UDP 92.123.103.96:https > 192.168.1.3:65534 / Raw
Ether / IP / UDP 92.123.103.96:https > 192.168.1.3:65534 / Raw
Ether / IP / UDP 92.123.103.96:https > 192.168.1.3:65534 / Raw
Ether / IP / UDP 192.168.1.3:65534 > 92.123.103.96:https / Raw
Ether / IP / UDP 192.168.1.3:65534 > 92.123.103.96:https / Raw
Ether / IP / UDP 192.168.1.3:65534 > 92.123.103.96:https / Raw
Ether / IP / UDP 192.168.1.3:65534 > 92.123.103.96:https / Raw
Ether / IP / UDP 192.168.1.3:65534 > 92.123.103.96:https / Raw
Ether / IP / UDP 192.168.1.3:65534 > 92.123.103.96:https / Raw
Ether / IP / UDP 192.168.1.3:65534 > 92.123.103.96:https / Raw
Ether / IP / UDP 192.168.1.3:65534 > 92.123.103.96:https / Raw
Ether / IP / UDP 192.168.1.3:65534 > 92.123.103.96:https / Raw
Ether / IP / UDP 192.168.1.3:65534 > 92.123.103.96:https / Raw
Ether / IP / UDP 192.168.1.3:65534 > 92.123.103.96:https / Raw
Ether / IP / UDP 192.168.1.3:65534 > 92.123.103.96:https / Raw
Ether / IP / UDP 92.123.103.96:https > 192.168.1.3:65534 / Raw
Ether / IP / UDP 92.123.103.96:https > 192.168.1.3:65534 / Raw
Ether / IP / UDP 92.123.103.96:https > 192.168.1.3:65534 / Raw
Ether / IP / UDP 92.123.103.96:https > 192.168.1.3:65534 / Raw
Ether / IP / UDP 92.123.103.96:https > 192.168.1.3:65534 / Raw
Ether / IP / UDP 92.123.103.96:https > 192.168.1.3:65534 / Raw
Ether / IP / UDP 92.123.103.96:https > 192.168.1.3:65534 / Raw
Ether / IP / UDP 92.123.103.96:https > 192.168.1.3:65534 / Raw
Ether / IP / UDP 192.168.1.3:65534 > 92.123.103.96:https / Raw
Ether / IP / UDP 192.168.1.3:65534 > 92.123.103.96:https / Raw
Ether / IP / UDP 192.168.1.3:65534 > 92.123.103.96:https / Raw
Ether / IP / UDP 192.168.1.3:65534 > 92.123.103.96:https / Raw
Ether / IP / UDP 92.123.103.96:https > 192.168.1.3:65534 / Raw
Ether / IP / UDP 92.123.103.96:https > 192.168.1.3:65534 / Raw
Ether / IP / UDP 92.123.103.96:https > 192.168.1.3:65534 / Raw
Ether / IP / UDP 92.123.103.96:https > 192.168.1.3:65534 / Raw
Ether / IP / UDP 92.123.103.96:https > 192.168.1.3:65534 / Raw
Ether / IP / UDP 92.123.103.96:https > 192.168.1.3:65534 / Raw
Ether / IP / UDP 92.123.103.96:https > 192.168.1.3:65534 / Raw
Ether / IP / UDP 92.123.103.96:https > 192.168.1.3:65534 / Raw
Ether / IP / UDP 92.123.102.209:https > 192.168.1.3:65224 / Raw
Ether / IP / UDP 92.123.102.209:https > 192.168.1.3:65224 / Raw
Ether / IP / UDP 92.123.102.209:https > 192.168.1.3:65224 / Raw
Ether / IP / UDP 192.168.1.3:65534 > 92.123.103.96:https / Raw
Ether / IP / UDP 192.168.1.3:65534 > 92.123.103.96:https / Raw
Ether / IP / UDP 192.168.1.3:65224 > 92.123.102.209:https / Raw
Ether / IP / UDP 192.168.1.3:65224 > 92.123.102.209:https / Raw
Ether / IP / UDP 92.123.102.209:https > 192.168.1.3:65224 / Raw
Ether / IP / UDP 192.168.1.3:65534 > 92.123.103.96:https / Raw
Ether / IP / UDP 192.168.1.3:65224 > 92.123.102.209:https / Raw
Ether / IP / UDP 92.123.103.96:https > 192.168.1.3:65534 / Raw
Ether / IP / UDP 92.123.102.209:https > 192.168.1.3:65224 / Raw
Ether / IP / UDP 92.123.102.209:https > 192.168.1.3:65224 / Raw
Ether / IP / UDP 92.123.102.209:https > 192.168.1.3:65224 / Raw
Ether / IP / UDP 92.123.102.209:https > 192.168.1.3:65224 / Raw
Ether / IP / UDP 92.123.102.209:https > 192.168.1.3:65224 / Raw
Ether / IP / UDP 92.123.102.209:https > 192.168.1.3:65224 / Raw
Ether / IP / UDP 92.123.102.209:https > 192.168.1.3:65224 / Raw
Ether / IP / UDP 92.123.102.209:https > 192.168.1.3:65224 / Raw
Ether / IP / UDP 92.123.102.209:https > 192.168.1.3:65224 / Raw
Ether / IP / UDP 92.123.102.209:https > 192.168.1.3:65224 / Raw
Ether / IP / UDP 92.123.102.209:https > 192.168.1.3:65224 / Raw
Ether / IP / UDP 92.123.102.209:https > 192.168.1.3:65224 / Raw
Ether / IP / UDP 92.123.102.209:https > 192.168.1.3:65224 / Raw
Ether / IP / UDP 192.168.1.3:65224 > 92.123.102.209:https / Raw
Ether / IP / UDP 192.168.1.3:65224 > 92.123.102.209:https / Raw
Ether / IP / UDP 192.168.1.3:65224 > 92.123.102.209:https / Raw
Ether / IP / UDP 192.168.1.3:65224 > 92.123.102.209:https / Raw
Ether / IP / UDP 192.168.1.3:65224 > 92.123.102.209:https / Raw
Ether / IP / UDP 192.168.1.3:65224 > 92.123.102.209:https / Raw
Ether / IP / UDP 92.123.102.209:https > 192.168.1.3:65224 / Raw
Ether / IP / UDP 92.123.102.209:https > 192.168.1.3:65224 / Raw
Ether / IP / UDP 192.168.1.3:65224 > 92.123.102.209:https / Raw
Ether / IP / UDP 192.168.1.3:65224 > 92.123.102.209:https / Raw
Ether / IP / UDP 92.123.102.209:https > 192.168.1.3:65224 / Raw
Ether / IP / UDP 92.123.102.209:https > 192.168.1.3:65224 / Raw
Ether / IP / UDP 192.168.1.3:65224 > 92.123.102.209:https / Raw
Ether / IP / TCP 192.168.1.3:51011 > 172.67.201.151:https PA / Raw
Ether / IP / TCP 172.67.201.151:https > 192.168.1.3:51011 PA / Raw
Ether / IP / TCP 192.168.1.3:51011 > 172.67.201.151:https A
Ether / IP / UDP 192.168.1.3:65534 > 92.123.103.96:https / Raw
Ether / IP / UDP 192.168.1.3:65534 > 92.123.103.96:https / Raw
Ether / IP / UDP 192.168.1.3:65534 > 92.123.103.96:https / Raw
Ether / IP / UDP 92.123.103.96:https > 192.168.1.3:65534 / Raw
Ether / IP / UDP 92.123.103.96:https > 192.168.1.3:65534 / Raw
Ether / IP / UDP 92.123.103.96:https > 192.168.1.3:65534 / Raw
Ether / IP / UDP 92.123.103.96:https > 192.168.1.3:65534 / Raw
Ether / IP / UDP 92.123.103.96:https > 192.168.1.3:65534 / Raw
Ether / IP / UDP 92.123.103.96:https > 192.168.1.3:65534 / Raw
Ether / IP / UDP 92.123.103.96:https > 192.168.1.3:65534 / Raw
Ether / IP / UDP 92.123.103.96:https > 192.168.1.3:65534 / Raw
Ether / IP / UDP 92.123.103.96:https > 192.168.1.3:65534 / Raw
Ether / IP / UDP 92.123.103.96:https > 192.168.1.3:65534 / Raw
Ether / IP / UDP 92.123.103.96:https > 192.168.1.3:65534 / Raw
Ether / IP / UDP 92.123.103.96:https > 192.168.1.3:65534 / Raw
Ether / IP / UDP 92.123.103.96:https > 192.168.1.3:65534 / Raw
Ether / IP / UDP 192.168.1.3:65534 > 92.123.103.96:https / Raw
Ether / IP / UDP 92.123.103.96:https > 192.168.1.3:65534 / Raw
Ether / IP / UDP 92.123.103.96:https > 192.168.1.3:65534 / Raw
Ether / IP / UDP 92.123.103.96:https > 192.168.1.3:65534 / Raw
Ether / IP / UDP 92.123.103.96:https > 192.168.1.3:65534 / Raw
Ether / IP / UDP 92.123.103.96:https > 192.168.1.3:65534 / Raw
Ether / IP / UDP 92.123.103.96:https > 192.168.1.3:65534 / Raw
Ether / IP / UDP 92.123.103.96:https > 192.168.1.3:65534 / Raw
Ether / IP / UDP 92.123.103.96:https > 192.168.1.3:65534 / Raw
Ether / IP / UDP 92.123.103.96:https > 192.168.1.3:65534 / Raw
Ether / IP / UDP 92.123.103.96:https > 192.168.1.3:65534 / Raw
Ether / IP / UDP 92.123.103.96:https > 192.168.1.3:65534 / Raw
Ether / IP / UDP 92.123.103.96:https > 192.168.1.3:65534 / Raw
Ether / IP / UDP 92.123.103.96:https > 192.168.1.3:65534 / Raw
Ether / IP / UDP 92.123.103.96:https > 192.168.1.3:65534 / Raw
Ether / IP / UDP 92.123.103.96:https > 192.168.1.3:65534 / Raw
Ether / IP / UDP 92.123.103.96:https > 192.168.1.3:65534 / Raw
Ether / IP / UDP 92.123.103.96:https > 192.168.1.3:65534 / Raw
Ether / IP / UDP 92.123.103.96:https > 192.168.1.3:65534 / Raw
Ether / IP / UDP 92.123.103.96:https > 192.168.1.3:65534 / Raw
Ether / IP / UDP 92.123.103.96:https > 192.168.1.3:65534 / Raw
Ether / IP / UDP 92.123.103.96:https > 192.168.1.3:65534 / Raw
Ether / IP / UDP 92.123.103.96:https > 192.168.1.3:65534 / Raw
Ether / IP / UDP 92.123.103.96:https > 192.168.1.3:65534 / Raw
Ether / IP / UDP 92.123.103.96:https > 192.168.1.3:65534 / Raw
Ether / IP / UDP 92.123.103.96:https > 192.168.1.3:65534 / Raw
Ether / IP / UDP 92.123.103.96:https > 192.168.1.3:65534 / Raw
Ether / IP / UDP 92.123.103.96:https > 192.168.1.3:65534 / Raw
Ether / IP / UDP 92.123.103.96:https > 192.168.1.3:65534 / Raw
Ether / IP / UDP 92.123.103.96:https > 192.168.1.3:65534 / Raw
Ether / IP / UDP 92.123.103.96:https > 192.168.1.3:65534 / Raw
Ether / IP / UDP 92.123.103.96:https > 192.168.1.3:65534 / Raw
Ether / IP / UDP 92.123.103.96:https > 192.168.1.3:65534 / Raw
Ether / IP / UDP 192.168.1.3:65534 > 92.123.103.96:https / Raw
Ether / IP / UDP 192.168.1.3:65534 > 92.123.103.96:https / Raw
Ether / IP / UDP 92.123.103.96:https > 192.168.1.3:65534 / Raw
Ether / IP / UDP 92.123.103.96:https > 192.168.1.3:65534 / Raw
Ether / IP / UDP 92.123.103.96:https > 192.168.1.3:65534 / Raw
Ether / IP / UDP 92.123.103.96:https > 192.168.1.3:65534 / Raw
Ether / IP / UDP 92.123.103.96:https > 192.168.1.3:65534 / Raw
Ether / IP / UDP 92.123.103.96:https > 192.168.1.3:65534 / Raw
Ether / IP / UDP 92.123.103.96:https > 192.168.1.3:65534 / Raw
Ether / IP / UDP 92.123.103.96:https > 192.168.1.3:65534 / Raw
Ether / IP / UDP 92.123.103.96:https > 192.168.1.3:65534 / Raw
Ether / IP / UDP 192.168.1.3:65534 > 92.123.103.96:https / Raw
Ether / IP / UDP 192.168.1.3:65534 > 92.123.103.96:https / Raw
Ether / IP / UDP 192.168.1.3:65534 > 92.123.103.96:https / Raw
Ether / IP / UDP 192.168.1.3:65534 > 92.123.103.96:https / Raw
Ether / IP / UDP 92.123.103.96:https > 192.168.1.3:65534 / Raw
Ether / IP / UDP 92.123.103.96:https > 192.168.1.3:65534 / Raw
Ether / IP / UDP 192.168.1.1:40465 > 239.255.255.250:ssdp / Raw
Ether / IP / UDP 192.168.1.1:40465 > 239.255.255.250:ssdp / Raw
Ether / IP / UDP 192.168.1.1:40465 > 239.255.255.250:ssdp / Raw
Ether / IP / UDP 192.168.1.1:40465 > 239.255.255.250:ssdp / Raw
Ether / IP / UDP 192.168.1.1:40465 > 239.255.255.250:ssdp / Raw
Ether / IP / UDP 192.168.1.1:40465 > 239.255.255.250:ssdp / Raw
Ether / IP / UDP 192.168.1.1:40465 > 239.255.255.250:ssdp / Raw
Ether / IP / UDP 192.168.1.1:40465 > 239.255.255.250:ssdp / Raw
Ether / IP / UDP 192.168.1.1:40465 > 239.255.255.250:ssdp / Raw
Ether / IP / UDP 192.168.1.1:40465 > 239.255.255.250:ssdp / Raw
Ether / IP / UDP 192.168.1.1:40465 > 239.255.255.250:ssdp / Raw
Ether / ARP who has 192.168.1.3 says 192.168.1.1
Ether / ARP is at 94:bb:43:88:a2:cc says 192.168.1.3
Ether / IP / UDP / DNS Qry b'errortracking.deepl.com.'
Ether / IP / UDP / DNS Qry b'w.deepl.com.'
Ether / IP / UDP / DNS Qry b'w.deepl.com.'
Ether / IP / UDP / DNS Ans b'hpfal.deepl.com.'
Ether / IP / UDP / DNS Ans b'hpfal.deepl.com.'
Ether / IP / UDP / DNS Ans b'errortracking-lb.deepl.com.'
Ether / IP / UDP / DNS Qry b'errortracking-lb.deepl.com.'
Ether / IP / UDP / DNS Qry b'4186979c18134d1eae82ec64dbfc9af2.pacloudflare.com.'
Ether / IP / TCP 192.168.1.3:51030 > 194.124.204.71:https S
Ether / IP / TCP 192.168.1.3:51031 > 172.65.225.25:https S
Ether / IP / UDP / DNS Ans 194.124.204.71
Ether / IP / UDP / DNS Ans 172.65.225.25
Ether / IP / TCP 172.65.225.25:https > 192.168.1.3:51031 SA
Ether / IP / TCP 192.168.1.3:51031 > 172.65.225.25:https A
Ether / IP / UDP / DNS Qry b'4186979c18134d1eae82ec64dbfc9af2.pacloudflare.com.'
Ether / IP / UDP / DNS Qry b'errortracking-lb.deepl.com.'
Ether / IP / TCP 192.168.1.3:51031 > 172.65.225.25:https A / Raw
Ether / IP / TCP 192.168.1.3:51031 > 172.65.225.25:https PA / Raw
Ether / IP / TCP 172.65.225.25:https > 192.168.1.3:51031 A
Ether / IP / TCP 172.65.225.25:https > 192.168.1.3:51031 A
Ether / IP / UDP / DNS Ans
Ether / IP / UDP / DNS Ans
Ether / IP / TCP 194.124.204.71:https > 192.168.1.3:51030 SA
Ether / IP / TCP 192.168.1.3:51030 > 194.124.204.71:https A
Ether / IP / TCP 192.168.1.3:51030 > 194.124.204.71:https A / Raw
Ether / IP / TCP 192.168.1.3:51030 > 194.124.204.71:https PA / Raw
Ether / IP / TCP 172.65.225.25:https > 192.168.1.3:51031 A / Raw
Ether / IP / TCP 172.65.225.25:https > 192.168.1.3:51031 PA / Raw
Ether / IP / TCP 172.65.225.25:https > 192.168.1.3:51031 PA / Raw
Ether / IP / TCP 192.168.1.3:51031 > 172.65.225.25:https A
Ether / IP / TCP 192.168.1.3:51031 > 172.65.225.25:https PA / Raw
Ether / IP / TCP 192.168.1.3:51031 > 172.65.225.25:https PA / Raw
Ether / IP / TCP 192.168.1.3:51031 > 172.65.225.25:https PA / Raw
Ether / IP / TCP 192.168.1.3:51031 > 172.65.225.25:https PA / Raw
Ether / IP / TCP 194.124.204.71:https > 192.168.1.3:51030 A
Ether / IP / TCP 194.124.204.71:https > 192.168.1.3:51030 A / Raw
Ether / IP / TCP 194.124.204.71:https > 192.168.1.3:51030 PA / Raw
Ether / IP / TCP 194.124.204.71:https > 192.168.1.3:51030 PA / Raw
Ether / IP / TCP 192.168.1.3:51030 > 194.124.204.71:https A
Ether / IP / TCP 192.168.1.3:51030 > 194.124.204.71:https PA / Raw
Ether / IP / TCP 192.168.1.3:51030 > 194.124.204.71:https PA / Raw
Ether / IP / TCP 192.168.1.3:51030 > 194.124.204.71:https PA / Raw
Ether / IP / TCP 192.168.1.3:51030 > 194.124.204.71:https PA / Raw
Ether / IP / TCP 192.168.1.3:51030 > 194.124.204.71:https PA / Raw
Ether / IP / TCP 192.168.1.3:51030 > 194.124.204.71:https PA / Raw
Ether / IP / TCP 192.168.1.3:51030 > 194.124.204.71:https PA / Raw
Ether / IP / TCP 192.168.1.3:51030 > 194.124.204.71:https A / Raw
Ether / IP / TCP 192.168.1.3:51030 > 194.124.204.71:https PA / Raw
Ether / IP / TCP 172.65.225.25:https > 192.168.1.3:51031 A
Ether / IP / TCP 172.65.225.25:https > 192.168.1.3:51031 A
Ether / IP / TCP 172.65.225.25:https > 192.168.1.3:51031 A
Ether / IP / TCP 172.65.225.25:https > 192.168.1.3:51031 A
Ether / IP / TCP 172.65.225.25:https > 192.168.1.3:51031 PA / Raw
Ether / IP / TCP 172.65.225.25:https > 192.168.1.3:51031 PA / Raw
Ether / IP / TCP 172.65.225.25:https > 192.168.1.3:51031 PA / Raw
Ether / IP / TCP 192.168.1.3:51031 > 172.65.225.25:https A
Ether / IP / TCP 192.168.1.3:51031 > 172.65.225.25:https PA / Raw
Ether / IP / TCP 172.65.225.25:https > 192.168.1.3:51031 A / Raw
Ether / IP / TCP 172.65.225.25:https > 192.168.1.3:51031 PA / Raw
Ether / IP / TCP 172.65.225.25:https > 192.168.1.3:51031 PA / Raw
Ether / IP / TCP 192.168.1.3:51031 > 172.65.225.25:https A
Ether / IP / TCP 172.65.225.25:https > 192.168.1.3:51031 A
Ether / IP / TCP 194.124.204.71:https > 192.168.1.3:51030 PA / Raw
Ether / IP / TCP 194.124.204.71:https > 192.168.1.3:51030 PA / Raw
Ether / IP / TCP 194.124.204.71:https > 192.168.1.3:51030 PA / Raw
Ether / IP / TCP 194.124.204.71:https > 192.168.1.3:51030 A
Ether / IP / TCP 194.124.204.71:https > 192.168.1.3:51030 PA / Raw
Ether / IP / TCP 192.168.1.3:51030 > 194.124.204.71:https A
Ether / IP / TCP 192.168.1.3:51030 > 194.124.204.71:https PA / Raw
Ether / IP / TCP 194.124.204.71:https > 192.168.1.3:51030 A
Ether / IP / TCP 194.124.204.71:https > 192.168.1.3:51030 PA / Raw
Ether / IP / TCP 194.124.204.71:https > 192.168.1.3:51030 PA / Raw
Ether / IP / TCP 194.124.204.71:https > 192.168.1.3:51030 PA / Raw
Ether / IP / TCP 192.168.1.3:51030 > 194.124.204.71:https A
Ether / IP / TCP 194.124.204.71:https > 192.168.1.3:51030 PA / Raw
Ether / IP / TCP 192.168.1.3:51030 > 194.124.204.71:https A
Ether / IP / TCP 194.124.204.71:https > 192.168.1.3:51030 A
Ether / IP / TCP 192.168.1.3:50476 > 155.133.252.68:27022 PA / Raw
Ether / IP / TCP 155.133.252.68:27022 > 192.168.1.3:50476 A
Ether / IP / TCP 192.168.1.3:51010 > 142.250.185.238:https PA / Raw
Ether / IP / TCP 142.250.185.238:https > 192.168.1.3:51010 A
Ether / IP / TCP 142.250.185.238:https > 192.168.1.3:51010 PA / Raw
